tipo;name;nickname;age;profession;date;embed;desc;coordsLat;coordsLng;chronology;photo;link;organizer;etiquetas1;etiquetas2;etiquetas3;etiquetas4
patrimonio material;"El Arco";;;;;;"Aledo durante siglos se ha abastecido de agua procedentes de los nacimientos de las inmediaciones de Sierra Espuña entre otras fuentes. La fuente de la Olla Bermeja, abastecía el municipio de Aledo, mediante caños y conducciones que hacian llegar el agua hasta el casco urbano. Muestra de estas construcciones es el Arco de Aledo, que se situa a 2 km de Aledo en dirección Sierra Espuña/Zarzadilla de Totana. Este Arco, que se conserva magnificamente, es uno de los vestigios que quedan de conducciones de agua, que discurrían desde nacimientos existentes hasta zonas cercanas a viviendas. En la entrada de Aledo, exactamente donde se encuentra hoy en día la redonda que da entrada al casco urbano, se situaba un arco muy similar a este, que conducía el agua hasta la fuente de la plaza de la Diputación y la Fuente de los Marqueses. En la actualidad, apenas quedan vestigios de estas conducciones dentro del casco urbano. Este arco se encuentra en un punto singular, dado que aquí confluyen varios senderos de largo y corto recorrido así como el camino que llega hasta la ciudad Santa de Caravaca de la Cruz y el camino que lleva hasta el Monasterio de Santa Eulalia.";37.808174;-1.569043;;https://s2.wklcdn.com/image_159/4786028/54072621/36094790.400x300.jpg;;;;;;;;
patrimonio material;"Puerta de las Tradiciones";;;;;;"La Puerta de las Tradiciones, es uno de los momumentos más recientes de la villa de Aledo. Este monumento, obra de Antonio Labaña Serrano, se inauguró en el año 2008. Este monumento es una puerta, la cual encierra las tradiciones más importantes que durante siglos han perdurado en esta población. La puerta en sí es de bronce, enmarcada en piedra travertino y custodiada por dos columnas de la misma piedra. La puerta se divide en cuatro partes principalmente, recogiendo tradiciones y cultura como el Auto de Reyes, el auto sacramental de La Agonía de viernes santo, los jirillos del día de San Marcos, el canto del "motete", la cuadrilla, las imagenes de San Agustín y Santa María la Real, el Corpus Cristhi, la uva....y todas las señas de identidad de este municipio";37.79158492697334;-1.57346535205345;;https://turismopanoramico.es/wp-content/uploads/2014/07/puertadelastradiciones.jpg;;;;;;
patrimonio natural;"Estrecho de la Arboleja";;;;;https://www.youtube.com/embed/dJ_mvqTxNLc;"A solo 2 km del casco urbano de Aledo, el Estrecho de la Arboleja es un impresionante cañón de piedra caliza modelado por la erosión del agua a lo largo de los siglos. Con unos 500 metros de longitud y paredes que alcanzan varias decenas de metros de altura, este paraje natural sorprende por sus formas rocosas únicas y la presencia constante del agua, que forma pequeños manantiales y charcas entre las rocas. Se puede acceder a pie por el Sendero nº 31 de la Red de Senderos Ecoturísticos de la Región de Murcia, o en coche desde la carretera C-21 Aledo–Lorca, siguiendo las indicaciones hacia el Estrecho. Un corto camino rural y un puente de madera conducen hasta la zona de aparcamiento y barbacoas, desde donde parte el sendero que desciende bajo un algarrobo centenario hacia la entrada del cañón.";37.783363246256286;-1.5957578173488616;;https://services.meteored.com/img/article/estrecho-de-la-arboleja-una-ruta-por-el-antelope-canyon-espanol-1712987874549_512.jpeg;https://es.wikiloc.com/rutas-senderismo/circular-estrecho-arboleja-aledo-36324728;;;;;
patrimonio natural;"Cueva 'La Mauta'";;;;;;"El paraje de la cabecera de la rambla de los Molinos (Aledo) permite al visitante conocer cómo actúan los procesos geológicos, tanto pasados como actuales, para lograr que un paisaje semiárido posea valores culturales muy diversos. Procesos geológicos antiguos, ocurridos hace millones de años, medios marinos profundos, arrecifes coralinos, playas y deltas, crearon sus rocas. Procesos geológicos recientes, cuyo agente más importante es el agua, las esculpen. El agua, la herramienta que la Naturaleza ha utilizado para modelar estas viejas rocas, ha dado lugar a una diversidad geológica muy amplia: manantiales, barrancos, desprendimientos, terrazas… Pero su obra de arte es la cueva de la Mauta, una simbiosis entre agua, gea y flora, petrificada en travertinos.";37.79086600421617;-1.5834321888516847;;https://s0.wklcdn.com/image_23/693030/174036408/108595908Master.jpg;https://es.wikiloc.com/rutas-senderismo/cueva-de-mauta-acueducto-y-molino-de-patalache-aledo-murcia-174036407;;;;
patrimonio natural;"Sierra Espuña";;;;;https://www.youtube.com/embed/D9WdVIR2kl0;"Aledo se encuentra en plena Sierra Espuña, siendo este el Parque Natural más importante de la Región de Murcia. En él, podemos encontrar numerosas posibilidades para llevar a cabo actividades al aire libre, como senderismo, rutas en bici, vuelo en parapente, etc. Lugares tan emblemáticos de este parque son los pozos de la nieve, el Morrón, el centro Ricardo Codorniú, etc. En este centro los visitantes, mediante paneles, pueden informarse de los valores naturales protegidos, en especial de la fauna, y de la vegetación";37.858401266851644;-1.5126688104824897;;https://www.la7tv.es/media/la7tv/images/2022/11/13/2022111313243668564.jpg;https://es.wikiloc.com/rutas-senderismo/sierra-espuna-57667114;;;;;
patrimonio natural;"El Ninonero";;;;;;"Uno de los símbolos naturales más emblemáticos de Aledo es “El Ninonero” (Celtis australis), un árbol centenario que ha acompañado a generaciones de vecinos y vecinas. Cada primavera se viste de hojas y continúa siendo testigo de la vida cotidiana del pueblo, desde los juegos de los niños hasta los momentos más señalados de la comunidad. Con su majestuoso porte, da la bienvenida a quien llega y se ha convertido en un referente del paisaje urbano y del patrimonio natural de Aledo. Los habitantes lo consideran un “aleano” más, y el Ayuntamiento trabaja activamente para preservarlo, reconociendo su valor como patrimonio vivo, cargado de historia y memoria colectiva.";37.797488470994686;-1.5738714549602055;;https://www.totananoticias.com/uploads/images/2025/05/image_750x500_681c9e7b76261.jpg;;;;;;
servicios;Policia Local de Aledo;;;;;;"La Policía Local de Aledo trabaja cada día al servicio de los vecinos y visitantes del municipio, con el compromiso de garantizar la seguridad, el bienestar y la convivencia ciudadana. Su labor se centra en la protección de las personas, el control del tráfico, la atención en emergencias y el cumplimiento de las ordenanzas municipales. Con cercanía y profesionalidad, el cuerpo policial mantiene una relación directa con la ciudadanía, actuando siempre con vocación de ayuda y servicio público. Dirección: C/ Santiago s/n, 30859 Aledo (Murcia) Teléfonos: 696 96 21 14 Telefono Benemerita: Guardia Civil Totana Emergencias: 112 Correo: policia@aledo.es";37.79613414147941;-1.5724853209024194;;https://www.aledo.es/assets/img/escudo_policia.jpg;;;;;;;
servicios;Proteccion Civil de Aledo;;;;;;"La Protección Civil de Aledo está formada por un grupo de voluntarios comprometidos con la seguridad y el bienestar de todos los vecinos y visitantes del municipio. Su labor se basa en la entrega, la solidaridad y la vocación de servicio, ofreciendo su tiempo y esfuerzo para ayudar en cualquier situación de emergencia o necesidad. El equipo cuenta con diferentes unidades operativas, como la Unidad Canina, la Unidad de Rescate en Montaña, la Unidad de Reconocimiento y la Unidad de Alta Movilidad, además de nuevas incorporaciones que seguirán fortaleciendo su labor en el futuro. Su compromiso y disponibilidad constante hacen de Protección Civil un pilar esencial en la prevención, auxilio y apoyo a la comunidad de Aledo. Dirección: C/ Santiago s/n, 30859 Aledo (Murcia) Teléfono: 696 96 21 14 Teléfono Benemerita: Guardia Civil Totana Emergencias: 112 Correo: proteccioncivil@aledo.es";37.79618799401158;-1.5723660569218723;;https://pbs.twimg.com/profile_images/1987830238827409408/Xi4H5MaX_400x400.jpg;;;;;;;
servicios;Ayuntamiendo de Aledo;;;;;;"El Ayuntamiento de Aledo es la institución encargada de la administración y gestión del municipio, trabajando para mejorar la calidad de vida de sus habitantes y promover el desarrollo local. A través de sus diferentes áreas y servicios, el Ayuntamiento ofrece atención a los ciudadanos, fomenta la participación ciudadana y gestiona recursos para el bienestar común. Con un compromiso firme con la transparencia, la eficiencia y la innovación, el Ayuntamiento de Aledo busca construir una comunidad próspera, inclusiva y sostenible. Dirección: Plaza del Ayuntamiento, s/n, 30859 Aledo (Murcia) Teléfono: 968 43 50 01 Fax: 968 43 50 02 Correo:";37.79197285989981;-1.5731086103515723";;https://www.aledo.es/img/noticias/5f62f9aca3568773ead8179d7c4e67eb.png;;;;;;;
servicios;Consultorio Medico de Aledo;;;;;;"El Consultorio Médico de Aledo es un centro de atención primaria que ofrece servicios de salud a los residentes del municipio y sus alrededores. El consultorio local de Aledo cuenta con servicio de pediatría, enfermería y servicio médico. Tlf: 968 48 44 82 Horario: Lunes a viernes de 8:00-2:30 aprox";37.79538933732368;-1.572852895898981;;https://aslan.es/wp-content/uploads/2021/02/LogoMurciaSalud.png;;;;;;;
servicios;Farmacia Martin Rodriguez;;;;;;"La Farmacia Martín Rodríguez, ubicada en el corazón de Aledo, es un establecimiento comprometido con la salud y el bienestar de la comunidad. Con un equipo de profesionales altamente capacitados, la farmacia ofrece una amplia gama de productos farmacéuticos, asesoramiento personalizado y servicios de atención al cliente. Su misión es proporcionar un servicio de calidad, promoviendo hábitos saludables y facilitando el acceso a medicamentos y productos de cuidado personal. ";37.794475250527;-1.5733775256110243;;https://de.cdn-website.com/3af970ba13d04c32b6f6947e9e97ba03/MOBILE/png/551214-farmacia-martin-rodriguez-logo.png;;;;;;;
servicios;Pabellon Munipal de Aledo;;;;;;"El Pabellón Municipal de Aledo es un espacio polideportivo diseñado para fomentar la actividad física y el deporte entre los habitantes del municipio. Equipado con instalaciones versátiles, el pabellón ofrece una variedad de actividades deportivas, desde baloncesto y voleibol hasta gimnasia y clases de fitness. Además, el pabellón sirve como punto de encuentro para eventos deportivos y comunitarios, promoviendo un estilo de vida saludable y activo en Aledo. Dispone de gimnasio abierto todos los días con horario de 6:00 a 22:00h, se puede reservar a través de la app Bando Móvil. El horario del pabellón es de tarde, de 17:00 a 21:00 de lunes a sábado. Telefono: 968 48 44 22";37.8007604887458;-1.5744023830297635;;https://www.aledo.es/img/logo_pabellon.jpg;;;;;;;
